{
  "$schema": "https://json-schema.org/draft/2020-12/schema",
  "$id": "https://raw.githubusercontent.com/AIAllTheThingz/Public-Access-Agents/main/schemas/v1/test-evidence.schema.json",
  "title": "Test Evidence",
  "description": "Records an executed or explicitly not-run validation command, result, environment, timing, evidence, and limitations.",
  "type": "object",
  "additionalProperties": false,
  "required": [
    "testType",
    "command",
    "result"
  ],
  "properties": {
    "testType": {
      "type": "string",
      "minLength": 1
    },
    "command": {
      "type": "string",
      "minLength": 1
    },
    "result": {
      "enum": [
        "passed",
        "failed",
        "not-run"
      ]
    },
    "environment": {
      "type": "string",
      "minLength": 1
    },
    "startedAt": {
      "type": "string",
      "format": "date-time"
    },
    "completedAt": {
      "type": "string",
      "format": "date-time"
    },
    "evidence": {
      "type": "string",
      "minLength": 1
    },
    "limitations": {
      "type": "array",
      "items": {
        "type": "string",
        "minLength": 1
      }
    },
    "artifact": {
      "type": "string",
      "minLength": 1
    },
    "exitCode": {
      "type": "integer"
    },
    "schemaVersion": {
      "type": "string",
      "const": "1.0.0",
      "description": "Optional explicit instance contract version. Omitted legacy instances are interpreted as version 1.0.0."
    },
    "extensions": {
      "type": "object",
      "description": "Namespaced extension data. Extension keys must be organization- or product-specific and must not redefine standard fields.",
      "propertyNames": {
        "pattern": "^[A-Za-z][A-Za-z0-9_.-]{1,127}$"
      },
      "additionalProperties": true
    }
  },
  "x-schemaVersion": "1.0.0"
}
